{
  "schema_version": "1.0",
  "blueprint_id": "kontext-base",
  "blueprint_name": "Kontext-Profil + PARA (Basis)",
  "blueprint_version": "1.0.0",
  "author": "ewtos.com",
  "license": "MIT",
  "description": "Persönliches Zweites Gehirn: Kontext-Profil (Über mich, Zielgruppe, Angebot, Schreibstil, Branding) als zentrale Referenzschicht + PARA-Buckets. Standard-Basis für jeden Vault — die KI weiß, wer du bist. Bringt die Obsidian-Skills mit.",
  "tags": ["kontext", "para", "basis", "personal"],
  "category": "base",
  "when_to_use": "Standard für jeden Vault: die KI kennt dich (Kontext-Profil), du hast PARA-Struktur, Seiten-Vorlagen, Skills und Wartungs-Commands.",
  "extends": [],
  "folders": [
    { "path": "inbox", "kind": "system" },
    { "path": "kontext", "kind": "system", "label": "kontext", "emoji": "🧭" },
    { "path": "wiki/projects", "kind": "bucket", "label": "projects", "emoji": "🎯" },
    { "path": "wiki/areas", "kind": "bucket", "label": "areas", "emoji": "🔁" },
    { "path": "wiki/resources", "kind": "bucket", "label": "resources", "emoji": "📚" },
    { "path": "wiki/archive", "kind": "bucket", "label": "archive", "emoji": "🗄" },
    { "path": "journal", "kind": "journal", "auto_archive": "briefing" },
    { "path": "templates", "kind": "system", "label": "templates", "emoji": "📐" }
  ],
  "files": [
    { "path": "agents.md", "template": "kontext-base/agents.md.j2", "merge_policy": "skip_if_exists" },
    { "path": "index.md", "template": "kontext-base/index.md.j2", "merge_policy": "skip_if_exists" },
    { "path": "log.md", "template": "kontext-base/log.md.j2", "merge_policy": "skip_if_exists" },
    { "path": "inbox/todos.md", "template_inline": "---\ntyp: todos\n---\n\n", "merge_policy": "skip_if_exists" },
    { "path": "inbox/scratchpad.md", "template": "kontext-base/inbox/scratchpad.md.j2", "merge_policy": "skip_if_exists" },
    { "path": "kontext/ueber-mich.md", "template": "kontext-base/kontext/ueber-mich.md.j2", "merge_policy": "skip_if_exists" },
    { "path": "kontext/zielgruppe.md", "template": "kontext-base/kontext/zielgruppe.md.j2", "merge_policy": "skip_if_exists" },
    { "path": "kontext/angebot.md", "template": "kontext-base/kontext/angebot.md.j2", "merge_policy": "skip_if_exists" },
    { "path": "kontext/schreibstil.md", "template": "kontext-base/kontext/schreibstil.md.j2", "merge_policy": "skip_if_exists" },
    { "path": "kontext/branding.md", "template": "kontext-base/kontext/branding.md.j2", "merge_policy": "skip_if_exists" },
    { "path": "wiki/index.md", "template": "kontext-base/wiki/index.md.j2", "merge_policy": "skip_if_exists" },
    { "path": "anleitung.md", "template": "kontext-base/anleitung.md.j2", "merge_policy": "skip_if_exists" },
    { "path": "templates/wissensseite.md", "template": "kontext-base/templates/wissensseite.md.j2", "merge_policy": "skip_if_exists" },
    { "path": "templates/projekt.md", "template": "kontext-base/templates/projekt.md.j2", "merge_policy": "skip_if_exists" },
    { "path": "templates/bereich.md", "template": "kontext-base/templates/bereich.md.j2", "merge_policy": "skip_if_exists" },
    { "path": "templates/kunde.md", "template": "kontext-base/templates/kunde.md.j2", "merge_policy": "skip_if_exists" },
    { "path": "templates/quelle.md", "template": "kontext-base/templates/quelle.md.j2", "merge_policy": "skip_if_exists" }
  ],
  "bases": [],
  "claude_md_sections": [
    {
      "id": "kontext-profil",
      "order": 5,
      "title": "Kontext-Profil",
      "template": "kontext-base/claude-md/kontext.md.j2",
      "merge_policy": "replace_if_marker"
    },
    {
      "id": "vault-schema",
      "order": 10,
      "title": "Vault-Schema",
      "template": "kontext-base/claude-md/schema.md.j2",
      "merge_policy": "replace_if_marker"
    },
    {
      "id": "seiten-vorlagen",
      "order": 15,
      "title": "Seiten-Vorlagen",
      "template": "kontext-base/claude-md/vorlagen.md.j2",
      "merge_policy": "replace_if_marker"
    },
    {
      "id": "vault-wartung",
      "order": 25,
      "title": "Vault-Wartung & Commands",
      "template": "kontext-base/claude-md/wartung.md.j2",
      "merge_policy": "replace_if_marker"
    }
  ],
  "briefing_sources": ["wetter", "todos", "fristen"],
  "permissions_defaults": { "write_raw": false, "write_playlists": false },
  "skills": ["obsidian-markdown", "obsidian-bases", "obsidian-cli", "json-canvas", "defuddle"],
  "commands": ["lint", "rebuild-index", "audit"]
}
